{"schema_version":"1.0","test_id":"EAP-TEST-RC-001","control_ids":["EAP-CTRL-004","EAP-CTRL-005","EAP-CTRL-015"],"subject":{"system_id":"sample-critical-operations-agent","deployment_id":"prod-critical-01"},"started_at":"2026-08-22T15:22:00Z","completed_at":"2026-08-22T15:23:00Z","result":"pass","observations":[{"sequence_gaps":0,"vendor_dashboard_used":false},{"verifier_result":"complete"}],"evidence":[{"artifact_type":"test_result","path_or_url":"examples/eap-l3-worked-example/test-results/EAP-TEST-RC-001.json","sha256":null}],"runner":{"name":"eap-reference-runner","version":"0.9.2","adapter":"synthetic-reference"}}
