{"schema_version":"1.0","test_id":"EAP-TEST-RP-001","control_ids":["EAP-CTRL-006"],"subject":{"system_id":"sample-critical-operations-agent","deployment_id":"prod-critical-01"},"started_at":"2026-08-22T15:21:00Z","completed_at":"2026-08-22T15:21:03Z","result":"pass","observations":[{"replay_detection":true,"side_effect_count":0},{"audit_event":"recorded"}],"evidence":[{"artifact_type":"test_result","path_or_url":"examples/eap-l3-worked-example/test-results/EAP-TEST-RP-001.json","sha256":null}],"runner":{"name":"eap-reference-runner","version":"0.9.2","adapter":"synthetic-reference"}}
