{"schema_version":"1.0","test_id":"EAP-TEST-EI-001","control_ids":["EAP-CTRL-001","EAP-CTRL-003"],"subject":{"system_id":"sample-critical-operations-agent","deployment_id":"prod-critical-01"},"started_at":"2026-08-22T15:20:00Z","completed_at":"2026-08-22T15:20:05Z","result":"pass","observations":[{"verification_result":"rejected","reason":"digest_mismatch"},{"audit_event":"recorded"}],"evidence":[{"artifact_type":"test_result","path_or_url":"examples/eap-l3-worked-example/test-results/EAP-TEST-EI-001.json","sha256":null}],"runner":{"name":"eap-reference-runner","version":"0.9.2","adapter":"synthetic-reference"}}
